{
  "schema_version": "1.0.0",
  "id": "angular-ci-cache-trust-2026",
  "title": "Angular automation trust and cache isolation weakness",
  "organization": "Google",
  "product": "Angular development and release infrastructure",
  "researchers": [
    "Adnan Khan"
  ],
  "cve_ids": [],
  "cwe_mappings": [],
  "category_id": "supply-chain",
  "secondary_category_ids": [
    "injection",
    "authorization"
  ],
  "skillset_ids": [
    "pipeline-trust-modeling",
    "cache-artifact-isolation",
    "machine-identity-governance",
    "secrets-containment",
    "approval-state-integrity",
    "defensive-evidence-writing"
  ],
  "summary": "Angular's build automation did not adequately separate untrusted work from trusted build state. The researcher demonstrated credential exposure and described a possible route to repository control, but did not carry out the final supply-chain change. Google awarded the report a bounty.",
  "root_cause": "Untrusted workflow input and shared build state crossed trust boundaries; bot-specific approval assumptions increased the potential consequence.",
  "impact": "The researcher demonstrated credential exposure and modeled the remaining path to repository control without executing the final supply-chain modification. Google classified the report as a flagship supply-chain compromise.",
  "defensive_takeaways": [
    "Separate caches and artifacts according to trust level.",
    "Apply consistent review invalidation and least-privilege rules to automated identities.",
    "Record which impacts were directly demonstrated versus established through design evidence."
  ],
  "reward": {
    "amount": 31337,
    "currency": "USD",
    "scope": "single_report",
    "status": "awarded",
    "evidence_level": "researcher_reported_with_vendor_quote",
    "source_id": "primary",
    "evidence_quote": "decided to issue a reward of $31337.00 for your report",
    "evidence_location": "Success section, quoted Google award email",
    "usd_equivalent": null,
    "notes": "A Google award email is quoted within the researcher publication; it is not an independently accessed vendor award record. The quote uses only $. USD is a contextual currency inference from the official OSS VRP rules (currency-context), whose Reward amounts section explicitly denominates discretionary bonuses in USD. Those living rules were reviewed on October 3, 2026, after the January 28 award; their wording at award time was not established. They are denomination context only, not proof of this individual award or settlement. No bonus is established or added.",
    "type": "bug_bounty",
    "awarding_organization": "Google"
  },
  "dates": {
    "published": {
      "value": "2026-03-03",
      "precision": "day",
      "basis": "explicit",
      "source_id": "primary",
      "note": null
    },
    "public_disclosure": {
      "value": "2026-03-03",
      "precision": "day",
      "basis": "explicit",
      "source_id": "primary",
      "note": "Publication of this write-up; earliest disclosure elsewhere was not independently established."
    },
    "reported": {
      "value": "2025-12-11",
      "precision": "day",
      "basis": "explicit",
      "source_id": "primary",
      "note": null
    },
    "awarded": {
      "value": "2026-01-28",
      "precision": "day",
      "basis": "explicit",
      "source_id": "primary",
      "note": null
    },
    "fixed": {
      "value": "2025-12-21",
      "precision": "day",
      "basis": "explicit",
      "source_id": "primary",
      "note": "Researcher timeline says the report was marked fixed on this date; deployment timing and patch effectiveness were not independently verified."
    },
    "paid": {
      "value": null,
      "precision": null,
      "basis": "not_reported",
      "source_id": null,
      "note": "Cash settlement date not independently established."
    },
    "award_announced": {
      "value": null,
      "precision": null,
      "basis": "not_reported",
      "source_id": null,
      "note": null
    },
    "mitigated": {
      "value": "2025-12-12",
      "precision": "day",
      "basis": "explicit",
      "source_id": "primary",
      "note": "Researcher timeline records disabling the workflow as mitigation."
    }
  },
  "recency": {
    "as_of": "2026-10-03",
    "window_start": "2025-10-03",
    "within_preferred_window": true,
    "basis": "published",
    "note": null
  },
  "sources": [
    {
      "id": "primary",
      "url": "https://adnanthekhan.com/posts/angular-compromise-through-dev-infra/",
      "title": "Turning Almost Nothing into a Supply Chain Compromise of Angular with GitHub Actions Cache Poisoning",
      "type": "researcher",
      "author": "Adnan Khan",
      "retrieved_at": "2026-10-03T19:52:01Z",
      "supports": [
        "reward",
        "dates",
        "root_cause",
        "impact",
        "remediation"
      ]
    },
    {
      "id": "currency-context",
      "url": "https://bughunters.google.com/about/rules/open-source/google-open-source-software-vulnerability-reward-program-rules#reward-amounts",
      "title": "Google Open Source Software Vulnerability Reward Program Rules — Reward amounts",
      "type": "vendor",
      "author": "Google",
      "retrieved_at": "2026-10-03T19:53:20Z",
      "supports": [
        "reward"
      ]
    }
  ],
  "primary_source_id": "primary",
  "verification": {
    "status": "included",
    "reviewed_at": "2026-10-03T19:54:00Z",
    "method": "Primary researcher award and timeline reread; official OSS VRP rules read for contextual denomination only. Award distinguished from program maximums and aggregate earnings. No vulnerability testing performed.",
    "limitations": [
      "The reward is an actual award reported in a primary researcher account; payment settlement was not independently audited.",
      "USD is contextually inferred from later program-level denomination wording, not explicitly stated in the quoted individual award. No conflicting denomination was identified in the reviewed sources."
    ]
  },
  "content_scope": "historical_defensive_summary"
}
