{
  "schema_version": "1.0.0",
  "id": "hackerone-report-json-serialization-data-exposure-2025",
  "title": "Framework serialization change exposed private HackerOne user attributes",
  "organization": "HackerOne",
  "product": "HackerOne report serialization",
  "researchers": [
    "avinash_"
  ],
  "cve_ids": [],
  "cwe_mappings": [
    {
      "id": "CWE-200",
      "basis": "source_explicit",
      "source_id": "primary",
      "note": "The vendor explicitly labels the report Information Disclosure (CWE-200)."
    }
  ],
  "category_id": "information-exposure",
  "secondary_category_ids": [
    "authorization"
  ],
  "skillset_ids": [
    "secure-parser-review",
    "untrusted-input-handling",
    "authorization-modeling",
    "patch-verification"
  ],
  "summary": "A framework upgrade caused HackerOne's public report responses to include private contributor attributes. Tests missed the exposure because parsing the response hid a duplicate field that remained visible in the raw output. HackerOne confirmed a USD 25,000 award; the public report explains both the serialization change and the testing gap.",
  "root_cause": "An internal user object and its sanitized public version used the same field name with different Ruby key types. According to the vendor, earlier serialization kept only the public version, but the framework upgrade emitted both. Snapshot tests parsed the response again and discarded the earlier duplicate, hiding private data that was still present in the raw output. This affected disclosed reports with a reporter or team-member summary. The failure concerned application output after a framework change, not an AI agent.",
  "impact": "The vendor reproduced private-attribute exposure. The public report describes personal and security-sensitive account attributes, but does not demonstrate account takeover or establish an affected-user count or wider exploitation. The vendor announced a deployed fix on February 21, 2025; the researcher retested and observed only intended public attributes for team and reporter summaries. The exact code change is not disclosed.",
  "defensive_takeaways": [
    "Editorial lesson: construct public responses from explicit safe fields rather than relying on later serialization to overwrite an internal object.",
    "Editorial lesson: test both raw serialized output and parsed structure; normalization can hide duplicate fields and sensitive data.",
    "Editorial lesson: treat framework upgrades as changes to security-relevant output semantics, and exercise nested representations with private-field exclusion assertions."
  ],
  "reward": {
    "amount": 25000,
    "currency": "USD",
    "scope": "single_report",
    "type": "bug_bounty",
    "awarding_organization": "HackerOne",
    "status": "awarded",
    "evidence_level": "vendor_confirmed",
    "source_id": "primary",
    "evidence_quote": "Reward: $25,000",
    "evidence_location": "Primary article award statement",
    "usd_equivalent": null,
    "notes": "Vendor confirms the individual report’s reward; the public report records the award event on February 21, 2025, while settlement remains unreported. The award article uses a dollar sign; current official HackerOne standards supply USD context only. Exhibit C reproduces guideline version 1.2 dated July 29, 2019 and specifies USD on printed page 12, supplying historical platform context rather than individual payment proof."
  },
  "dates": {
    "published": {
      "value": "2025-04-01",
      "precision": "day",
      "basis": "explicit",
      "source_id": "technical-report",
      "note": "Public technical report disclosure date; the later vendor case study was published June 24, 2025."
    },
    "public_disclosure": {
      "value": "2025-04-01",
      "precision": "day",
      "basis": "explicit",
      "source_id": "technical-report",
      "note": null
    },
    "reported": {
      "value": "2025-02-19",
      "precision": "day",
      "basis": "explicit",
      "source_id": "technical-report",
      "note": null
    },
    "awarded": {
      "value": "2025-02-21",
      "precision": "day",
      "basis": "explicit",
      "source_id": "technical-report",
      "note": "Public timeline records the bounty event; the vendor case study establishes its USD 25,000 amount. Separate retest compensation is not included."
    },
    "fixed": {
      "value": "2025-02-21",
      "precision": "day",
      "basis": "explicit",
      "source_id": "technical-report",
      "note": "Vendor deployment confirmation and successful researcher retest appear on this day; exact deployment time is not established."
    },
    "paid": {
      "value": null,
      "precision": null,
      "basis": "not_reported",
      "source_id": null,
      "note": null
    },
    "award_announced": {
      "value": null,
      "precision": null,
      "basis": "not_reported",
      "source_id": null,
      "note": null
    },
    "mitigated": {
      "value": null,
      "precision": null,
      "basis": "not_reported",
      "source_id": null,
      "note": null
    }
  },
  "recency": {
    "as_of": "2026-10-03",
    "window_start": "2025-10-03",
    "within_preferred_window": false,
    "basis": "published",
    "note": "Historical primary publication, outside the preferred last-12-month window."
  },
  "sources": [
    {
      "id": "primary",
      "url": "https://www.hackerone.com/blog/hai-insight-agent-case-study",
      "title": "We’re Running Hai Insight Agent on Our Own Bug Bounty Program – See it in Action",
      "type": "vendor",
      "author": "Crystal Hazen / HackerOne",
      "retrieved_at": "2026-10-03T08:59:00Z",
      "supports": [
        "reward",
        "dates",
        "root_cause",
        "impact",
        "remediation"
      ]
    },
    {
      "id": "currency-context",
      "url": "https://www.hackerone.com/terms/disclosure-guidelines",
      "title": "Vulnerability Disclosure Standards",
      "type": "platform",
      "author": "HackerOne",
      "retrieved_at": "2026-10-02T23:03:50Z",
      "supports": [
        "reward"
      ]
    },
    {
      "id": "historical-currency-context",
      "url": "https://www.carahsoft.com/buy/gsa-schedule-contracts/approved-csas/docFileDownload/286450/24c3653f-9d13-4944-8f2e-5baa23efa63c",
      "title": "HackerOne terms and disclosure guidelines in official reseller GSA contract attachment, Exhibit C",
      "type": "platform",
      "author": "HackerOne / Carahsoft (contract attachment)",
      "retrieved_at": "2026-10-02T23:05:44Z",
      "supports": [
        "reward"
      ]
    },
    {
      "id": "technical-report",
      "url": "https://hackerone.com/reports/3000510",
      "title": "Public report 3000510: private user attributes exposed in report serialization",
      "type": "vendor",
      "author": "HackerOne and avinash_",
      "retrieved_at": "2026-10-03T08:59:00Z",
      "supports": [
        "dates",
        "root_cause",
        "impact",
        "remediation",
        "reward"
      ]
    }
  ],
  "primary_source_id": "primary",
  "verification": {
    "status": "included",
    "reviewed_at": "2026-10-03T08:59:00Z",
    "method": "Freshly read the vendor case study and the public technical report in the cloud browser, including vendor root-cause explanation and timeline. No target testing. Existing denomination sources retained without a fresh review.",
    "limitations": [
      "Award evidence does not establish settlement; the USD 25,000 amount comes from the case study, while the report hides the bounty amount.",
      "The technical report names the earlier Rails version as 6.1.7.9; the later case study says 6.1.7.10. Both identify the upgrade to 7.1.5.1; the discrepancy is unresolved.",
      "The case study describes retest validation within an hour, but visible retest-request and completion timestamps are about 72 minutes apart. Edited timeline timestamps and deployment timing limit precise duration comparisons.",
      "The public sources do not establish exact authentication prerequisites, affected-user count, a code-level patch, or successful account compromise.",
      "Currency context includes currently reviewed standards dated July 27, 2026 and historical platform guidelines; neither independently proves individual settlement."
    ]
  },
  "content_scope": "historical_defensive_summary"
}
