{
  "schema_version": "1.0.0",
  "id": "redis-deserialization-object-ownership-2026",
  "title": "Redis deserialization cleanup violated object-ownership invariants",
  "organization": "Redis",
  "product": "Redis serialized-object loading",
  "researchers": [
    "Emil Lerner"
  ],
  "cve_ids": [
    "CVE-2026-25243"
  ],
  "cwe_mappings": [
    {
      "id": "CWE-122",
      "basis": "source_explicit",
      "source_id": "vendor-cve",
      "note": "Vendor CNA category retained as published; the researcher describes double-free mechanisms within this broader advisory."
    }
  ],
  "category_id": "memory-safety",
  "secondary_category_ids": [
    "cloud-security"
  ],
  "skillset_ids": [
    "secure-parser-review",
    "memory-safety-review",
    "untrusted-input-handling",
    "patch-verification"
  ],
  "summary": "Redis could free the same memory twice when loading serialized objects and cleaning up failures. Code execution was demonstrated at the competition; the vendor limits the affected access to authenticated users with import permission, and wider effects depend on deployment privileges and isolation. Wiz confirms USD 30,000 for Emil Lerner's entry, with both related defects counted as one award.",
  "root_cause": "The researcher traced object ownership through deserialization and failure cleanup. Validation and conversion interpreted legacy data differently, while another cleanup path released an object still owned elsewhere. Both defects violated the invariant that each allocation is released exactly once; accepting a data-import request did not make its contents trustworthy.",
  "impact": "The researcher demonstrated code execution in the competition. The vendor confirms possible execution under Redis-process authority for an authenticated user with import permission. Host or tenant reach depends on deployment privileges and isolation; it is not established for every Redis installation.",
  "defensive_takeaways": [
    "Make ownership transfer and cleanup responsibility explicit on success and failure paths.",
    "Require validators and converters to interpret the same serialized representation consistently.",
    "Follow vendor patch guidance; restrict unnecessary import permissions using access controls while remediation is assessed."
  ],
  "reward": {
    "amount": 30000,
    "currency": "USD",
    "scope": "single_competition_entry",
    "type": "competition_award",
    "awarding_organization": "Wiz / ZeroDay.cloud",
    "status": "awarded",
    "evidence_level": "organizer_confirmed",
    "source_id": "competition-results",
    "evidence_quote": "$30,000 awarded",
    "evidence_location": "Redis: Emil Lerner entry in the organizer’s Day 1 results",
    "usd_equivalent": null,
    "notes": "One individually identified competition entry. The organizer uses $; its current rules establish US-dollar notation but concern 2026, not an archived 2025 rules snapshot. Exact award decision and cash settlement are unknown."
  },
  "dates": {
    "published": {
      "value": "2026-06-02",
      "precision": "day",
      "basis": "inferred",
      "source_id": "researcher-report",
      "note": "The article displays June 2; 2026 is inferred from its completed May 5, 2026 remediation timeline."
    },
    "public_disclosure": {
      "value": "2025-12-10",
      "precision": "day",
      "basis": "explicit",
      "source_id": "competition-tracker",
      "note": "Public competition demonstration; separate from later vendor advisory and technical publication."
    },
    "reported": {
      "value": null,
      "precision": null,
      "basis": "not_reported",
      "source_id": null,
      "note": "Exact initial report to the vendor is not stated; the tracker dates the competition entry, not vendor receipt."
    },
    "awarded": {
      "value": null,
      "precision": null,
      "basis": "not_reported",
      "source_id": null,
      "note": null
    },
    "fixed": {
      "value": "2026-05-05",
      "precision": "day",
      "basis": "explicit",
      "source_id": "vendor-release",
      "note": "Official Redis 8.6.3 release names the CVE. Researcher also identifies fixed versions in four other maintained series."
    },
    "paid": {
      "value": null,
      "precision": null,
      "basis": "not_reported",
      "source_id": null,
      "note": null
    },
    "award_announced": {
      "value": "2025-12-16",
      "precision": "day",
      "basis": "explicit",
      "source_id": "competition-results",
      "note": "Organizer recap confirms the per-entry award; decision and payment dates remain unknown."
    },
    "mitigated": {
      "value": null,
      "precision": null,
      "basis": "not_reported",
      "source_id": null,
      "note": null
    }
  },
  "recency": {
    "as_of": "2026-10-03",
    "window_start": "2025-10-03",
    "within_preferred_window": true,
    "basis": "published",
    "note": null
  },
  "sources": [
    {
      "id": "competition-results",
      "url": "https://www.wiz.io/blog/wiz-zeroday-cloud-hacking-competition-behind-the-scenes",
      "title": "ZeroDay.cloud 2025 individual competition results",
      "type": "competition_organizer",
      "author": "Nir Ohfeld / Wiz Research",
      "retrieved_at": "2026-10-02T19:21:00Z",
      "supports": [
        "reward",
        "dates"
      ]
    },
    {
      "id": "competition-tracker",
      "url": "https://www.zeroday.cloud/vulnerability-tracker",
      "title": "ZeroDay.cloud vulnerability tracker",
      "type": "competition_organizer",
      "author": "Wiz / ZeroDay.cloud",
      "retrieved_at": "2026-10-02T19:21:00Z",
      "supports": [
        "dates",
        "cve"
      ]
    },
    {
      "id": "currency-context",
      "url": "https://www.zeroday.cloud/rules",
      "title": "ZeroDay.cloud current rules: US-dollar denomination",
      "type": "competition_organizer",
      "author": "Wiz",
      "retrieved_at": "2026-10-02T19:21:00Z",
      "supports": [
        "reward"
      ]
    },
    {
      "id": "researcher-report",
      "url": "https://www.zeroday.cloud/blog/redis-cve-2026-25243-deep-dive",
      "title": "CVE-2026-25243: Two Redis RESTORE Bugs Leading to RCE",
      "type": "researcher",
      "author": "Emil Lerner / ZeroDay.cloud",
      "retrieved_at": "2026-10-02T19:21:00Z",
      "supports": [
        "dates",
        "root_cause",
        "impact",
        "remediation",
        "cve"
      ]
    },
    {
      "id": "vendor-advisory",
      "url": "https://github.com/redis/redis/security/advisories/GHSA-c8h9-259x-jff4",
      "title": "Redis serialized-value validation advisory GHSA-c8h9-259x-jff4",
      "type": "vendor",
      "author": "Redis",
      "retrieved_at": "2026-10-02T19:21:00Z",
      "supports": [
        "dates",
        "root_cause",
        "impact",
        "remediation",
        "cve"
      ]
    },
    {
      "id": "vendor-cve",
      "url": "https://github.com/CVEProject/cvelistV5/blob/main/cves/2026/25xxx/CVE-2026-25243.json",
      "title": "CVE-2026-25243 CNA record",
      "type": "vendor",
      "author": "Redis / GitHub CNA",
      "retrieved_at": "2026-10-02T19:21:00Z",
      "supports": [
        "dates",
        "root_cause",
        "impact",
        "remediation",
        "cve"
      ]
    },
    {
      "id": "vendor-release",
      "url": "https://github.com/redis/redis/releases/tag/8.6.3",
      "title": "Redis 8.6.3 security release",
      "type": "vendor",
      "author": "Redis",
      "retrieved_at": "2026-10-02T19:21:00Z",
      "supports": [
        "dates",
        "remediation",
        "cve"
      ]
    }
  ],
  "primary_source_id": "researcher-report",
  "verification": {
    "status": "included",
    "reviewed_at": "2026-10-02T19:21:00Z",
    "method": "Matched the individual award, exact CVE tracker row, named researcher explanation and vendor advisory. Checked release metadata for the fix date and kept two defects inside the single awarded entry.",
    "limitations": [
      "The vendor advisory also credits Joseph Surin; the reviewed award names Emil Lerner only, so no reward allocation to the additional credited researcher is inferred.",
      "The advisory’s patched-version field still says TBD, while the official 8.6.3 release explicitly lists the CVE as fixed; the CNA affected range also excludes 8.6.3.",
      "The researcher explains double-free mechanisms, while the CNA supplies CWE-122; neither classification is silently substituted for the other.",
      "Original vendor-report, award decision and settlement dates remain unknown; June 2 publication year is inferred.",
      "Current rules provide explicit USD context but are not the archived 2025 rules."
    ]
  },
  "content_scope": "historical_defensive_summary"
}
