{
  "schema_version": "1.0.0",
  "id": "google-support-api-authorization-2026",
  "title": "Google support API exposed customer and agent data",
  "organization": "Google",
  "product": "Google Real-time Support API",
  "researchers": [
    "Michael Dalton"
  ],
  "cve_ids": [],
  "cwe_mappings": [],
  "category_id": "authorization",
  "secondary_category_ids": [],
  "skillset_ids": [
    "authorization-modeling",
    "integration-threat-modeling",
    "defensive-evidence-writing"
  ],
  "summary": "Ordinary signed-in customers could read internal Google support activity and identifying details about other customers and agents. The researcher reports a USD 14,337 award. The number of affected records was estimated; access to conversation contents and control of calls were not demonstrated.",
  "root_cause": "Customer authentication did not enforce the boundary around internal support-wide information. The researcher contrasted denied resource-specific operations with an accessible aggregate operation. This supports an authorization gap; middleware behavior and the intended management use remain hypotheses, not confirmed implementation details.",
  "impact": "Observed disclosures linked customer names or phone numbers with cases and agents, including agent activity. Phishing and harassment were potential consequences. Millions of affected records were estimated; conversation contents and call manipulation were not demonstrated.",
  "defensive_takeaways": [
    "Editorial lesson: treat aggregate views as separately privileged resources; successful authentication is not evidence of permission to observe other users.",
    "Editorial lesson: reducing identifiable details limits the harm when a support-data boundary fails. The source does not document the deployed authorization repair."
  ],
  "reward": {
    "amount": 14337,
    "currency": "USD",
    "scope": "single_report",
    "status": "awarded",
    "type": "bug_bounty",
    "awarding_organization": "Google",
    "evidence_level": "researcher_reported_with_vendor_quote",
    "source_id": "primary",
    "evidence_quote": "Google VRP panel has decided to issue a reward of $14337.00 USD for your report.",
    "evidence_location": "Timeline, June 10, 2025",
    "usd_equivalent": null,
    "notes": "Single report award includes a USD 1,000 report-quality bonus; no settlement date is given."
  },
  "dates": {
    "published": {
      "value": "2026-03-31",
      "precision": "day",
      "basis": "explicit",
      "source_id": "primary",
      "note": null
    },
    "public_disclosure": {
      "value": "2026-03-31",
      "precision": "day",
      "basis": "explicit",
      "source_id": "primary",
      "note": null
    },
    "reported": {
      "value": "2025-06-01",
      "precision": "day",
      "basis": "explicit",
      "source_id": "primary",
      "note": null
    },
    "awarded": {
      "value": "2025-06-10",
      "precision": "day",
      "basis": "explicit",
      "source_id": "primary",
      "note": null
    },
    "fixed": {
      "value": null,
      "precision": null,
      "basis": "not_reported",
      "source_id": null,
      "note": "The source records closure as fixed on November 12, 2025, not a deployment date."
    },
    "paid": {
      "value": null,
      "precision": null,
      "basis": "not_reported",
      "source_id": null,
      "note": null
    },
    "award_announced": {
      "value": null,
      "precision": null,
      "basis": "not_reported",
      "source_id": null,
      "note": null
    },
    "mitigated": {
      "value": null,
      "precision": null,
      "basis": "not_reported",
      "source_id": null,
      "note": null
    }
  },
  "recency": {
    "as_of": "2026-10-03",
    "window_start": "2025-10-03",
    "within_preferred_window": true,
    "basis": "published",
    "note": null
  },
  "sources": [
    {
      "id": "primary",
      "url": "https://michaeldalton.au/posts/hacking-google-support",
      "title": "Hacking Google Support: Leaking millions of customer records ($14k bounty)",
      "type": "researcher",
      "author": "Michael Dalton",
      "retrieved_at": "2026-10-03T04:49:20Z",
      "supports": [
        "reward",
        "dates",
        "root_cause",
        "impact",
        "remediation"
      ]
    }
  ],
  "primary_source_id": "primary",
  "verification": {
    "status": "included",
    "reviewed_at": "2026-10-03T04:49:20Z",
    "method": "Fresh-read the primary disclosure and timeline; separated observed disclosure from hypothesized reach. No target testing or reproduction.",
    "limitations": [
      "Researcher-published evidence does not independently establish settlement, total affected population, backend implementation or deployed repair.",
      "The prerequisite was an ordinary signed-in account; describing the exposure as unauthenticated would erase that requirement."
    ]
  },
  "content_scope": "historical_defensive_summary"
}
